編號,案類,發生(現)日期,發生時段,發生(現)地點
321,汽車竊盜,1070413,14~16,台北縣三重市頂崁街210巷66弄(後方重劃區)
322,汽車竊盜,1070413,14~16,台北縣三重市頂崁街206巷66弄(重劃區)
323,汽車竊盜,1070421,04~06,台北市北投區東華里東華街2段271~300號
324,汽車竊盜,1070422,16~18,台北市萬華區(華中橋堤外停車場第2車場)
325,汽車竊盜,1070425,00~02,台北市信義區景聯里吳興街50巷
326,汽車竊盜,1070427,22~24,台北市士林區福志里福林路361~390號
327,汽車竊盜,1070506,02~04,台北市松山區富錦街77巷2弄1~30號
328,汽車竊盜,1070512,04~06,台北市大安區龍門里和平東路2段18巷1~30號
329,汽車竊盜,1070517,08~10,台北市文山區木柵里029鄰木柵路3段102巷6弄1~30號
330,汽車竊盜,1070519,12~14,台中市西區模範街40巷1~30號
331,汽車竊盜,1070527,10~12,台北市北投區洲美里洲美街271~300號
332,汽車竊盜,1070601,08~10,台北市中山區玉門街護國禪寺對面停車格(發生未送)
333,汽車竊盜,1070602,20~22,台北市北投區立農里承德路7段331~360號
334,汽車竊盜,1070605,08~10,台北市大同區民權西路102巷4弄1~30號
335,汽車竊盜,1070613,18~20,台北市北投區長安里育仁路(第37號
336,汽車竊盜,1070617,18~20,台北市中山區濱江街211~240號
337,汽車竊盜,1070617,22~24,台北市中山區濱江街211~240號
338,汽車竊盜,1070618,18~20,台北市北投區石牌里西安街1段151~180號
339,汽車竊盜,1070628,10~12,台北市北投區立賢里承德路7段211~240號
340,汽車竊盜,1070629,00~02,台北市信義區黎平里和平東路3段391巷8弄
341,汽車竊盜,1070629,16~18,台北市北投區智仁里杏林二路91~120號
342,汽車竊盜,1070702,02~04,台北市北投區八仙里大業路211~240號
343,汽車竊盜,1070711,10~12,台北市大安區義安里光復南路692巷1~30號
344,汽車竊盜,1070712,16~18,桃園縣桃園市介壽路419巷底
345,汽車竊盜,1070715,18~20,桃園縣龍潭鄉五福街200巷
346,汽車竊盜,1070717,00~02,台北市大安區群賢里和平東路3段1巷31~60號
347,汽車竊盜,1070722,04~06,台北縣五股鄉中興路3段1~30號
348,汽車竊盜,1070722,08~10,台北縣三峽鎮鴛山籃球場旁(停車場)
349,汽車竊盜,1070724,08~10,台北市士林區名山里1鄰雙溪街1~30號
350,汽車竊盜,1070725,04~06,台北縣三峽鎮介壽路1段276巷(內)
351,汽車竊盜,1070725,08~10,台北市南港區新光里忠孝東路7段124巷
352,汽車竊盜,1070727,04~06,桃園縣龜山鄉復興二路10巷1~30號
353,汽車竊盜,1070728,02~04,台北市南港區合成里忠孝東路6段151~180號
354,汽車竊盜,1070731,12~14,台北市北投區洲美里洲美街1~30號
355,汽車竊盜,1070731,16~18,台北市大安區龍圖里瑞安街151~180號
356,汽車竊盜,1070802,02~04,台北市中正區永功里泉州街32巷1~30號
357,汽車竊盜,1070805,10~12,桃園縣中壢市路環中東路﹑和祥街口
358,汽車竊盜,1070806,06~08,台北市南港區誠正國中後面(堤防邊(第25號
359,汽車竊盜,1070811,18~20,台北市北投區永和里行義路137段35弄(旁停車場)
360,汽車竊盜,1070813,10~12,台北市信義區雙和里吳興街284巷30弄(底)
361,汽車竊盜,1070814,00~02,台北市北投區奇岩里公館路228巷(與公館路334巷口)
362,汽車竊盜,1070815,06~08,台北縣三重市富貴里五華街121~150號
363,汽車竊盜,1070816,16~18,台北縣五股鄉中興路3段1~30號
364,汽車竊盜,1070821,08~10,台北縣林口鄉工三路1~30號
365,汽車竊盜,1070821,16~18,台北市北投區洲美里洲美街271~300號
366,汽車竊盜,1070822,20~22,台北市大同區民權西路102巷
367,汽車竊盜,1070825,12~14,台北市南港區東新里向陽路120巷2弄1~30號
368,汽車竊盜,1070826,14~16,台北市北投區一德里中央北路4段571~600號
369,汽車竊盜,1070828,16~18,台北市北投區八仙里大度路2段(往臺北方向無名巷內)
370,汽車竊盜,1070830,00~02,台北市信義區新仁里基隆路1段102巷
371,汽車竊盜,1070831,10~12,台北市大安區通化里通化街39巷61弄1~30號
372,汽車竊盜,1070903,12~14,台北縣汐止市明峰街中興路口
373,汽車竊盜,1070904,02~04,台北市北投區大同里大業路481~510號
374,汽車竊盜,1070910,14~16,台北市大安區群賢里四維路192巷1~30號
375,汽車竊盜,1070911,02~04,台北市信義區六合里信義路5段150巷421~450號
376,汽車竊盜,1070913,12~14,新竹縣湖口鄉民生街31~60號
377,汽車竊盜,1070917,04~06,台北市萬華區西藏路121~150號
378,汽車竊盜,1071010,02~04,台北市中正區水源里羅斯福路481~510號
379,汽車竊盜,1071015,04~06,台北市文山區樟文里019鄰辛亥路7段76巷1~30號
380,汽車竊盜,1071016,02~04,台北市萬華區萬大路486巷11弄1~30號
381,汽車竊盜,1071019,04~06,台北市中正區愛國西路48巷1~30號
382,汽車竊盜,1071026,06~08,桃園縣中壢市溪洲街267巷
383,汽車竊盜,1071028,08~10,台北市內湖區行愛路77巷31~60號
384,汽車竊盜,1071029,00~02,台北市大安區義安里敦化南路2段37巷2弄
385,汽車竊盜,1071103,08~10,台北市文山區(國道三號
386,汽車竊盜,1071106,06~08,台北市中山區復興北路與五常街口西南角
387,汽車竊盜,1071106,20~22,台北市士林區平等里3鄰平菁街95巷1~30號
388,汽車竊盜,1071112,22~24,台北縣淡水鎮沙崙路241~270號
389,汽車竊盜,1071115,22~24,台北市萬華區西園路2段31~60號
390,汽車竊盜,1071118,12~14,台北市大安區大學里新生南路3段76巷
391,汽車竊盜,1071204,08~10,台北市中正區建國里衡陽路61~90號
392,汽車竊盜,1071208,04~06,台北市松山區南京東路5段250巷18弄1~30號
393,汽車竊盜,1071208,16~18,台北市南港區新光里忠孝東路7段124巷
394,汽車竊盜,1071210,12~14,台北市大安區通安里樂利路5巷7弄1~30號
395,汽車竊盜,1071214,04~06,台北市松山區南京東路5段66巷3弄1~30號
396,汽車竊盜,1071215,06~08,台北市中山區民族東路481~510號
397,汽車竊盜,1071216,04~06,台北市大安區通安里安和路2段23巷1~30號
398,汽車竊盜,1071219,00~02,台北市萬華區艋舺大道390巷
399,汽車竊盜,1071220,06~08,台北市北投區八仙里大業路241~270號
400,汽車竊盜,1071225,10~12,台北市文山區萬隆里羅斯福路218巷38弄31~60號
401,汽車竊盜,1071227,20~22,台北市萬華區(雙園堤外平面停車場388號
402,汽車竊盜,1080101,04~06,台北市信義區吳興街156巷7弄1~30號
403,汽車竊盜,1080101,10~12,台北市松山區健康路241~270號
404,汽車竊盜,1080101,16~18,台北市萬華區(華中橋堤外停車場)
405,汽車竊盜,1080103,00~02,台北市士林區社園里通河西街2段121~150號
406,汽車竊盜,1080104,16~18,台北市萬華區(桂林路246巷環快橋下停車場62格)
407,汽車竊盜,1080108,12~14,台北市南港區新光里忠孝東路6段370巷1~30號
408,汽車竊盜,1080110,14~16,台北市萬華區(長順街底堤外便道第121號
409,汽車竊盜,1080115,04~06,台北市中正區文祥里金山南路1段121~150號
410,汽車竊盜,1080115,06~08,台北市南港區龍華街(內)
411,汽車竊盜,1080120,08~10,台北市中山區天津街61~90號
412,汽車竊盜,1080129,22~24,台北縣泰山鄉文程路91~120號
413,汽車竊盜,1080130,04~06,台北市北投區一德里中央北路4段404巷(口)
414,汽車竊盜,1080130,06~08,台北市北投區稻香里稻香路121~150號
415,汽車竊盜,1080205,04~06,台北縣三重市集英路61~90號
416,汽車竊盜,1080205,16~18,台北市北投區一德里大度路3段301~330號
417,汽車竊盜,1080415,12~14,台北市內湖區文德路31~60號
418,汽車竊盜,1080417,06~08,台北縣板橋市僑中二街120巷1~30號
419,汽車竊盜,1080520,02~04,台北市中正區林興里汀州路3段24巷(內)
420,汽車竊盜,1080603,06~08,台北縣石碇鄉南勢坑1號
421,汽車竊盜,1080615,06~08,台北市信義區中興里文昌街301~330號
422,汽車竊盜,1080622,22~24,台北市大安區通安里安和路2段59巷1~30號
